post_id,user_id,title,content,tag_name,category_name,status,date_published
1000,100116,"""sem ut""","""eu dolor egestas rhoncus. Proin nisl sem, consequat nec, mollis vitae, posuere at, velit. Cras lorem lorem, luctus ut, pellentesque eget, dictum""","""multigrains""","""Frying""","""Published""",5/17/2023 21:20
1001,100024,"""feugiat placerat""","""lorem ipsum sodales purus, in molestie tortor nibh sit amet orci. Ut sagittis lobortis mauris. Suspendisse aliquet molestie""","""pasta""","""Poaching""","""Draft""",10/2/2023 10:54
1002,100149,"""Quisque nonummy""","""libero. Donec consectetuer mauris id sapien. Cras dolor dolor, tempus non, lacinia at, iaculis""","""cookies""","""Braising""","""Draft""",6/20/2023 11:43
1003,100082,"""gravida sit""","""Donec est mauris, rhoncus id, mollis nec, cursus a, enim. Suspendisse aliquet, sem ut cursus luctus, ipsum leo elementum sem, vitae aliquam""","""vegetables""","""Steaming""","""Draft""",12/13/2023 11:03
1004,100054,"""tristique pellentesque,""","""Sed dictum. Proin eget odio. Aliquam vulputate ullamcorper magna. Sed eu eros. Nam consequat dolor vitae dolor. Donec fringilla. Donec feugiat""","""almonds""","""Roasting""","""Published""",5/26/2023 4:53
1005,100038,"""gravida sagittis.""","""tellus eu augue porttitor interdum. Sed auctor odio a purus. Duis elementum, dui quis accumsan convallis, ante lectus convallis est, vitae sodales nisi""","""cheese""","""Salads""","""Published""",6/9/2023 7:22
1006,100193,"""vehicula. Pellentesque""","""quam vel sapien imperdiet ornare. In faucibus. Morbi vehicula. Pellentesque tincidunt tempus risus. Donec egestas.""","""fasting""","""Frying""","""Published""",1/11/2024 7:59
1007,100193,"""Integer vulputate,""","""dictum. Phasellus in felis. Nulla tempor augue ac ipsum. Phasellus vitae mauris sit amet lorem""","""muffins, pistachios""","""Braising""","""Published""",6/20/2023 18:51
1008,100015,"""sagittis felis.""","""massa. Integer vitae nibh. Donec est mauris, rhoncus id, mollis nec, cursus a, enim. Suspendisse aliquet, sem ut""","""muffins""","""Braising""","""Draft""",7/22/2023 19:17
1009,100108,"""sagittis placerat.""","""semper erat, in consectetuer ipsum nunc id enim. Curabitur massa. Vestibulum accumsan neque et""","""chicken, seafood""","""Poaching""","""Published""",12/8/2023 21:06
1010,100006,"""metus. In""","""ipsum cursus vestibulum. Mauris magna. Duis dignissim tempor arcu. Vestibulum ut eros non enim commodo hendrerit. Donec porttitor tellus non""","""pasta, salads""","""Boiling""","""Published""",12/31/2023 11:15
1011,100103,"""lacinia orci,""","""sit amet ornare lectus justo eu arcu. Morbi sit amet massa. Quisque porttitor eros""","""sandwiches, chocolate""","""Grilling""","""Published""",9/20/2023 13:38
1012,100180,"""lorem, vehicula""","""mi fringilla mi lacinia mattis. Integer eu lacus. Quisque imperdiet, erat nonummy ultricies ornare,""","""chocolate, pizza""","""Baking""","""Published""",11/4/2023 11:27
1013,100026,"""enim. Etiam""","""Nulla semper tellus id nunc interdum feugiat. Sed nec metus facilisis lorem tristique aliquet. Phasellus fermentum convallis ligula.""","""multigrains, cookies""","""Poaching""","""Published""",9/11/2023 9:35
1014,100052,"""Vivamus euismod""","""enim, condimentum eget, volutpat ornare, facilisis eget, ipsum. Donec sollicitudin adipiscing ligula. Aenean gravida""","""salads""","""Braising""","""Draft""",3/25/2024 10:18
1015,100121,"""et netus""","""lacus. Aliquam rutrum lorem ac risus. Morbi metus. Vivamus euismod urna.""","""multigrains, pies""","""Roasting""","""Draft""",3/15/2024 19:47
1016,100101,"""dui quis""","""Sed malesuada augue ut lacus. Nulla tincidunt, neque vitae semper egestas, urna justo faucibus lectus, a sollicitudin""","""cheese, vegan""","""Sweets""","""Published""",5/5/2023 2:59
1017,100177,"""non nisi.""","""nec metus facilisis lorem tristique aliquet. Phasellus fermentum convallis ligula. Donec luctus aliquet odio. Etiam ligula tortor, dictum eu, placerat eget, venenatis a,""","""pie""","""Snacks""","""Published""",2/13/2024 23:20
1018,100105,"""nisi nibh""","""at lacus. Quisque purus sapien, gravida non, sollicitudin a, malesuada id, erat. Etiam vestibulum massa""","""multigrains""","""Baking""","""Draft""",4/18/2024 6:36
1019,100023,"""orci luctus""","""at, velit. Cras lorem lorem, luctus ut, pellentesque eget, dictum placerat,""","""cheese cake, walnuts""","""Frying""","""Published""",8/8/2023 7:35
1020,100157,"""ipsum. Phasellus""","""imperdiet dictum magna. Ut tincidunt orci quis lectus. Nullam suscipit, est ac facilisis facilisis, magna tellus faucibus leo, in lobortis tellus justo sit amet""","""soups""","""Cooking""","""Published""",1/9/2024 13:39
1021,100197,"""morbi tristique""","""sem ut cursus luctus, ipsum leo elementum sem, vitae aliquam eros turpis non enim. Mauris quis turpis vitae""","""bread""","""Desserts""","""Published""",1/26/2024 10:12
1022,100104,"""habitant morbi""","""risus. In mi pede, nonummy ut, molestie in, tempus eu, ligula. Aenean euismod mauris eu""","""healthy, chicken""","""Poaching""","""Published""",9/2/2023 6:34
1023,100175,"""commodo hendrerit.""","""ornare sagittis felis. Donec tempor, est ac mattis semper, dui lectus rutrum urna, nec luctus felis purus ac tellus. Suspendisse sed dolor. Fusce""","""chicken, brownie""","""Salads""","""Draft""",4/5/2024 7:59
1024,100198,"""facilisis, magna""","""Duis ac arcu. Nunc mauris. Morbi non sapien molestie orci tincidunt adipiscing. Mauris molestie pharetra nibh. Aliquam ornare, libero at auctor ullamcorper, nisl""","""eggs, keto""","""Salads""","""Published""",9/2/2023 23:12
1025,100099,"""libero. Proin""","""cursus a, enim. Suspendisse aliquet, sem ut cursus luctus, ipsum leo elementum sem, vitae aliquam eros turpis non enim. Mauris quis turpis""","""pizza""","""Frying""","""Draft""",11/19/2023 4:00
1026,100187,"""nisi sem""","""Duis ac arcu. Nunc mauris. Morbi non sapien molestie orci tincidunt adipiscing. Mauris""","""vegan, chocolate""","""Baking""","""Published""",10/26/2023 19:45
1027,100031,"""lobortis risus.""","""Aliquam tincidunt, nunc ac mattis ornare, lectus ante dictum mi, ac mattis velit justo nec ante.""","""multigrains, lamb""","""Salads""","""Published""",11/19/2023 3:58
1028,100038,"""Phasellus vitae""","""nulla. Donec non justo. Proin non massa non ante bibendum ullamcorper. Duis cursus, diam at pretium aliquet, metus urna convallis erat,""","""lamb, beef""","""Grilling""","""Draft""",10/28/2023 12:27
1029,100008,"""Quisque tincidunt""","""nisl. Maecenas malesuada fringilla est. Mauris eu turpis. Nulla aliquet. Proin velit. Sed malesuada augue ut lacus. Nulla tincidunt, neque""","""diet""","""Poaching""","""Published""",11/14/2023 1:17
1030,100103,"""sem. Nulla""","""lobortis, nisi nibh lacinia orci, consectetuer euismod est arcu ac orci. Ut semper pretium neque. Morbi quis urna. Nunc quis arcu vel quam""","""desserts""","""Grilling""","""Published""",2/18/2024 0:04
1031,100029,"""porta elit,""","""sagittis felis. Donec tempor, est ac mattis semper, dui lectus rutrum urna, nec luctus felis purus ac""","""chicken, keto""","""Roasting""","""Published""",2/3/2024 14:52
1032,100084,"""nunc nulla""","""vel pede blandit congue. In scelerisque scelerisque dui. Suspendisse ac metus vitae velit""","""walnuts, pasta""","""Poaching""","""Draft""",4/21/2024 5:27
1033,100106,"""fermentum vel,""","""ligula tortor, dictum eu, placerat eget, venenatis a, magna. Lorem ipsum dolor""","""fasting, cake""","""Broiling""","""Draft""",6/23/2023 4:30
1034,100112,"""ornare placerat,""","""tortor at risus. Nunc ac sem ut dolor dapibus gravida. Aliquam tincidunt, nunc ac mattis ornare, lectus ante dictum mi, ac""","""cheese cake, diet""","""Grilling""","""Draft""",2/5/2024 10:48
1035,100123,"""Sed nec""","""lorem, luctus ut, pellentesque eget, dictum placerat, augue. Sed molestie. Sed id risus quis diam luctus lobortis. Class aptent taciti sociosqu ad""","""almonds""","""Sweets""","""Draft""",5/3/2024 1:36
1036,100169,"""elit. Curabitur""","""enim mi tempor lorem, eget mollis lectus pede et risus. Quisque libero lacus, varius et,""","""beef, cocoa""","""Broiling""","""Draft""",3/5/2024 10:30
1037,100139,"""velit eget""","""justo nec ante. Maecenas mi felis, adipiscing fringilla, porttitor vulputate, posuere vulputate, lacus. Cras interdum. Nunc sollicitudin commodo""","""pie, keto""","""Salads""","""Published""",2/6/2024 20:46
1038,100133,"""et netus""","""metus. Aliquam erat volutpat. Nulla facilisis. Suspendisse commodo tincidunt nibh. Phasellus nulla. Integer vulputate, risus a ultricies adipiscing, enim mi tempor lorem, eget mollis lectus""","""pasta, walnuts""","""Desserts""","""Draft""",6/21/2023 4:37
1039,100098,"""ridiculus mus.""","""tincidunt tempus risus. Donec egestas. Duis ac arcu. Nunc mauris. Morbi non sapien molestie orci tincidunt adipiscing. Mauris molestie""","""cocoa, pasta""","""Cooking""","""Published""",9/8/2023 22:44
1040,100133,"""luctus vulputate,""","""dui, semper et, lacinia vitae, sodales at, velit. Pellentesque ultricies dignissim lacus. Aliquam rutrum lorem ac risus. Morbi metus. Vivamus""","""pies""","""Boiling""","""Published""",1/30/2024 22:30
1041,100061,"""bibendum fermentum""","""rutrum eu, ultrices sit amet, risus. Donec nibh enim, gravida sit amet, dapibus id, blandit at, nisi. Cum sociis natoque penatibus""","""brownie""","""Boiling""","""Published""",12/14/2023 8:24
1042,100011,"""mauris a""","""libero mauris, aliquam eu, accumsan sed, facilisis vitae, orci. Phasellus dapibus quam quis diam. Pellentesque habitant morbi tristique senectus et netus et malesuada fames""","""stews, pizza""","""Frying""","""Published""",6/27/2023 8:43
1043,100031,"""Curabitur massa.""","""diam luctus lobortis. Class aptent taciti sociosqu ad litora torquent per conubia nostra, per inceptos""","""cake, noodles""","""Steaming""","""Draft""",8/9/2023 0:44
1044,100137,"""non massa""","""fringilla. Donec feugiat metus sit amet ante. Vivamus non lorem vitae odio sagittis semper. Nam tempor diam dictum""","""fasting, seafood""","""Salads""","""Draft""",7/27/2023 6:21
1045,100068,"""porttitor eros""","""non leo. Vivamus nibh dolor, nonummy ac, feugiat non, lobortis quis, pede. Suspendisse dui. Fusce diam nunc, ullamcorper eu, euismod""","""cocoa, beef""","""Steaming""","""Published""",10/12/2023 18:01
1046,100091,"""lectus quis""","""nec, imperdiet nec, leo. Morbi neque tellus, imperdiet non, vestibulum nec, euismod in, dolor. Fusce feugiat. Lorem ipsum dolor sit amet, consectetuer adipiscing""","""pasta""","""Frying""","""Published""",11/26/2023 17:02
1047,100181,"""bibendum. Donec""","""nec tellus. Nunc lectus pede, ultrices a, auctor non, feugiat nec, diam. Duis mi""","""pistachios""","""Salads""","""Published""",2/27/2024 6:29
1048,100082,"""Proin non""","""porttitor interdum. Sed auctor odio a purus. Duis elementum, dui quis accumsan convallis, ante lectus convallis est, vitae sodales nisi magna sed dui. Fusce aliquam,""","""butter, cashews""","""Braising""","""Published""",5/9/2023 8:43
1049,100098,"""purus, in""","""ante ipsum primis in faucibus orci luctus et ultrices posuere cubilia Curae""","""lamb""","""Snacks""","""Published""",11/14/2023 20:02
1050,100073,"""feugiat tellus""","""non, hendrerit id, ante. Nunc mauris sapien, cursus in, hendrerit consectetuer,""","""pasta, lamb""","""Poaching""","""Draft""",4/2/2024 11:35
1051,100189,"""nunc interdum""","""dolor vitae dolor. Donec fringilla. Donec feugiat metus sit amet""","""pasta, pistachios""","""Salads""","""Published""",8/11/2023 1:56
1052,100104,"""placerat velit.""","""pede ac urna. Ut tincidunt vehicula risus. Nulla eget metus eu erat semper rutrum. Fusce dolor quam, elementum at, egestas a, scelerisque sed,""","""desserts, cake""","""Desserts""","""Published""",1/6/2024 1:33
1053,100133,"""Sed pharetra,""","""lacus, varius et, euismod et, commodo at, libero. Morbi accumsan laoreet ipsum.""","""pie, bread""","""Cooking""","""Published""",12/16/2023 7:08
1054,100146,"""turpis. In""","""in magna. Phasellus dolor elit, pellentesque a, facilisis non, bibendum sed, est. Nunc laoreet lectus""","""eggs, healthy""","""Desserts""","""Draft""",10/26/2023 10:49
1055,100172,"""Nunc mauris""","""iaculis aliquet diam. Sed diam lorem, auctor quis, tristique ac, eleifend vitae, erat. Vivamus nisi. Mauris nulla. Integer""","""soups, muffins""","""Desserts""","""Draft""",3/28/2024 4:02
1056,100057,"""tellus lorem""","""magna, malesuada vel, convallis in, cursus et, eros. Proin ultrices. Duis volutpat nunc""","""stews, pie""","""Frying""","""Published""",1/26/2024 10:56
1057,100039,"""Maecenas iaculis""","""nunc interdum feugiat. Sed nec metus facilisis lorem tristique aliquet. Phasellus fermentum convallis ligula. Donec luctus aliquet odio.""","""walnuts""","""Grilling""","""Draft""",4/8/2024 18:26
1058,100069,"""dictum. Phasellus""","""erat volutpat. Nulla dignissim. Maecenas ornare egestas ligula. Nullam feugiat placerat velit. Quisque varius. Nam porttitor scelerisque""","""muffins, cookies""","""Cooking""","""Draft""",10/1/2023 4:42
1059,100039,"""magna nec""","""ligula. Nullam feugiat placerat velit. Quisque varius. Nam porttitor scelerisque neque. Nullam nisl. Maecenas malesuada fringilla est. Mauris eu turpis. Nulla aliquet.""","""cookies, pie""","""Snacks""","""Published""",6/8/2023 21:02
1060,100099,"""non massa""","""risus. Donec egestas. Aliquam nec enim. Nunc ut erat. Sed nunc est,""","""eggs, cake""","""Broiling""","""Published""",9/19/2023 18:16
1061,100189,"""suscipit nonummy.""","""Sed congue, elit sed consequat auctor, nunc nulla vulputate dui, nec tempus mauris erat eget ipsum. Suspendisse sagittis. Nullam vitae diam. Proin dolor. Nulla""","""cookies""","""Broiling""","""Published""",2/13/2024 13:32
1062,100100,"""nunc sit""","""id, blandit at, nisi. Cum sociis natoque penatibus et magnis dis parturient montes, nascetur ridiculus mus. Proin vel""","""sandwiches""","""Snacks""","""Published""",10/13/2023 16:31
1063,100122,"""libero et""","""nec metus facilisis lorem tristique aliquet. Phasellus fermentum convallis ligula. Donec luctus aliquet odio. Etiam ligula tortor, dictum eu, placerat eget, venenatis a, magna.""","""beef""","""Frying""","""Draft""",3/7/2024 12:26
1064,100053,"""mauris. Morbi""","""Vestibulum ante ipsum primis in faucibus orci luctus et ultrices posuere cubilia Curae Donec tincidunt. Donec vitae erat vel pede blandit congue.""","""cheese, cocoa""","""Sweets""","""Draft""",2/17/2024 6:04
1065,100124,"""semper tellus""","""neque sed dictum eleifend, nunc risus varius orci, in consequat enim diam""","""cake, stews""","""Grilling""","""Published""",12/1/2023 21:01
1066,100180,"""rhoncus. Donec""","""sociis natoque penatibus et magnis dis parturient montes, nascetur ridiculus mus. Donec dignissim magna a""","""cashews, vegan""","""Frying""","""Published""",3/29/2024 8:32
1067,100146,"""Morbi vehicula.""","""Sed diam lorem, auctor quis, tristique ac, eleifend vitae, erat. Vivamus nisi.""","""desserts, pistachios""","""Desserts""","""Draft""",5/18/2023 3:50
1068,100170,"""euismod urna.""","""Sed dictum. Proin eget odio. Aliquam vulputate ullamcorper magna. Sed eu eros. Nam consequat dolor vitae dolor.""","""desserts""","""Braising""","""Published""",6/26/2023 12:58
1069,100041,"""eget metus.""","""urna, nec luctus felis purus ac tellus. Suspendisse sed dolor. Fusce mi lorem, vehicula et, rutrum eu, ultrices sit amet, risus. Donec nibh enim, gravida""","""stews""","""Sweets""","""Published""",4/3/2024 9:41
1070,100065,"""orci lobortis""","""et, lacinia vitae, sodales at, velit. Pellentesque ultricies dignissim lacus. Aliquam""","""pistachios, bread""","""Baking""","""Draft""",11/12/2023 17:55
1071,100014,"""egestas a,""","""eget, dictum placerat, augue. Sed molestie. Sed id risus quis diam luctus lobortis. Class aptent taciti sociosqu ad litora torquent per conubia nostra,""","""chicken, keto""","""Sweets""","""Draft""",11/25/2023 20:10
1072,100031,"""Sed pharetra,""","""tellus eu augue porttitor interdum. Sed auctor odio a purus. Duis elementum, dui quis accumsan""","""fasting, soups""","""Cooking""","""Draft""",3/16/2024 9:42
1073,100052,"""nec orci.""","""ornare. Fusce mollis. Duis sit amet diam eu dolor egestas rhoncus. Proin nisl sem, consequat nec, mollis vitae, posuere at,""","""almonds, cashews""","""Grilling""","""Draft""",10/22/2023 2:30
1074,100143,"""et nunc.""","""facilisis non, bibendum sed, est. Nunc laoreet lectus quis massa. Mauris vestibulum, neque sed""","""cashews, soups""","""Desserts""","""Published""",9/8/2023 1:42
1075,100054,"""aliquet. Phasellus""","""neque pellentesque massa lobortis ultrices. Vivamus rhoncus. Donec est. Nunc ullamcorper, velit in aliquet lobortis, nisi""","""multigrains, eggs""","""Boiling""","""Draft""",4/22/2024 5:38
1076,100016,"""lorem, luctus""","""et malesuada fames ac turpis egestas. Fusce aliquet magna a""","""fasting""","""Frying""","""Draft""",11/28/2023 10:15
1077,100127,"""arcu ac""","""iaculis, lacus pede sagittis augue, eu tempor erat neque non quam. Pellentesque""","""keto, cake""","""Grilling""","""Draft""",4/25/2024 12:57
1078,100053,"""egestas. Fusce""","""dui. Suspendisse ac metus vitae velit egestas lacinia. Sed congue, elit sed consequat auctor,""","""vegetables""","""Braising""","""Published""",3/17/2024 21:06
1079,100046,"""libero lacus,""","""lorem. Donec elementum, lorem ut aliquam iaculis, lacus pede sagittis augue, eu tempor erat neque non quam. Pellentesque habitant morbi tristique senectus""","""sandwiches, muffins""","""Cooking""","""Published""",8/31/2023 6:05
1080,100047,"""mi felis,""","""laoreet lectus quis massa. Mauris vestibulum, neque sed dictum eleifend, nunc risus varius orci, in""","""pasta, fasting""","""Salads""","""Draft""",10/1/2023 13:26
1081,100167,"""eget magna.""","""euismod est arcu ac orci. Ut semper pretium neque. Morbi quis urna. Nunc quis arcu vel quam dignissim pharetra. Nam""","""pie, keto""","""Cooking""","""Published""",8/9/2023 12:40
1082,100043,"""rutrum, justo.""","""vestibulum nec, euismod in, dolor. Fusce feugiat. Lorem ipsum dolor sit amet, consectetuer adipiscing elit. Aliquam auctor, velit eget laoreet""","""vegan""","""Snacks""","""Published""",12/13/2023 0:21
1083,100152,"""placerat, orci""","""quis diam. Pellentesque habitant morbi tristique senectus et netus et malesuada fames ac turpis egestas. Fusce aliquet magna a neque. Nullam ut nisi a""","""almonds, cheese""","""Snacks""","""Published""",4/22/2024 22:20
1084,100188,"""pretium neque.""","""non, vestibulum nec, euismod in, dolor. Fusce feugiat. Lorem ipsum dolor""","""pies""","""Steaming""","""Published""",8/11/2023 0:10
1085,100085,"""Sed et""","""tempus risus. Donec egestas. Duis ac arcu. Nunc mauris. Morbi non sapien molestie orci tincidunt adipiscing. Mauris molestie pharetra nibh. Aliquam ornare,""","""keto""","""Desserts""","""Draft""",5/11/2023 2:39
1086,100009,"""molestie tellus.""","""nec orci. Donec nibh. Quisque nonummy ipsum non arcu. Vivamus sit amet risus. Donec egestas. Aliquam nec enim. Nunc""","""cookies, beef""","""Baking""","""Published""",3/25/2024 8:46
1087,100169,"""libero mauris,""","""Cras dolor dolor, tempus non, lacinia at, iaculis quis, pede. Praesent eu""","""vegetables""","""Grilling""","""Draft""",10/26/2023 17:44
1088,100172,"""convallis in,""","""quis diam. Pellentesque habitant morbi tristique senectus et netus et malesuada fames ac turpis egestas. Fusce aliquet magna a neque. Nullam ut nisi a""","""vegan""","""Steaming""","""Draft""",3/3/2024 10:47
1089,100007,"""mattis ornare,""","""sit amet, dapibus id, blandit at, nisi. Cum sociis natoque penatibus et magnis dis parturient montes, nascetur ridiculus mus. Proin vel nisl.""","""cheese, cashews""","""Grilling""","""Published""",6/25/2023 22:34
1090,100043,"""Proin velit.""","""Sed diam lorem, auctor quis, tristique ac, eleifend vitae, erat. Vivamus nisi. Mauris nulla. Integer urna. Vivamus molestie dapibus ligula. Aliquam""","""pasta, walnuts""","""Boiling""","""Draft""",1/28/2024 10:43
1091,100137,"""id enim.""","""lobortis mauris. Suspendisse aliquet molestie tellus. Aenean egestas hendrerit neque. In ornare sagittis felis.""","""seafood, pasta""","""Boiling""","""Published""",9/14/2023 13:55
1092,100178,"""dolor. Quisque""","""lacus. Nulla tincidunt, neque vitae semper egestas, urna justo faucibus lectus, a sollicitudin orci sem eget massa. Suspendisse""","""vegan, bread""","""Cooking""","""Published""",1/7/2024 4:24
1093,100187,"""et nunc.""","""a, aliquet vel, vulputate eu, odio. Phasellus at augue id ante dictum cursus. Nunc mauris elit, dictum eu, eleifend nec, malesuada ut, sem.""","""vegetables, cocoa""","""Frying""","""Published""",12/13/2023 10:53
1094,100055,"""Nunc sollicitudin""","""elit, a feugiat tellus lorem eu metus. In lorem. Donec elementum, lorem ut aliquam iaculis, lacus pede sagittis augue, eu tempor""","""stews, cake""","""Frying""","""Draft""",7/22/2023 18:36
1095,100125,"""volutpat. Nulla""","""nibh. Aliquam ornare, libero at auctor ullamcorper, nisl arcu iaculis enim, sit amet ornare lectus justo""","""cookies, salads""","""Roasting""","""Published""",7/12/2023 6:34
1096,100034,"""nec metus""","""nulla. Integer vulputate, risus a ultricies adipiscing, enim mi tempor lorem, eget""","""muffins, pistachios""","""Grilling""","""Draft""",1/17/2024 1:16
1097,100176,"""at, egestas""","""Vivamus euismod urna. Nullam lobortis quam a felis ullamcorper viverra. Maecenas iaculis aliquet diam. Sed diam lorem,""","""brownie, butter""","""Poaching""","""Published""",12/30/2023 11:58
1098,100107,"""nisl. Nulla""","""risus. In mi pede, nonummy ut, molestie in, tempus eu, ligula. Aenean euismod mauris eu elit. Nulla facilisi. Sed neque. Sed""","""noodles, fasting""","""Frying""","""Draft""",12/24/2023 2:45
1099,100194,"""quis diam.""","""ante lectus convallis est, vitae sodales nisi magna sed dui.""","""chocolate, chicken""","""Desserts""","""Published""",2/26/2024 8:55
1100,100061,"""sagittis. Nullam""","""montes, nascetur ridiculus mus. Aenean eget magna. Suspendisse tristique neque venenatis lacus. Etiam bibendum fermentum metus. Aenean sed""","""vegetables, walnuts""","""Boiling""","""Published""",7/23/2023 14:48
1101,100048,"""penatibus et""","""quam vel sapien imperdiet ornare. In faucibus. Morbi vehicula. Pellentesque tincidunt tempus risus. Donec""","""walnuts""","""Sweets""","""Published""",5/24/2023 2:54
1102,100167,"""amet massa.""","""eget metus. In nec orci. Donec nibh. Quisque nonummy ipsum non""","""noodles, vegetables""","""Broiling""","""Draft""",1/23/2024 0:50
1103,100005,"""arcu ac""","""arcu vel quam dignissim pharetra. Nam ac nulla. In tincidunt congue turpis. In condimentum. Donec at arcu. Vestibulum ante""","""soups""","""Frying""","""Draft""",10/31/2023 2:12
1104,100118,"""tristique senectus""","""augue ac ipsum. Phasellus vitae mauris sit amet lorem semper auctor. Mauris vel turpis. Aliquam""","""salads, cookies""","""Grilling""","""Draft""",12/2/2023 12:15
1105,100111,"""mauris blandit""","""ut lacus. Nulla tincidunt, neque vitae semper egestas, urna justo faucibus lectus, a""","""seafood, salads""","""Desserts""","""Published""",4/22/2024 14:29
1106,100069,"""sem. Nulla""","""Pellentesque tincidunt tempus risus. Donec egestas. Duis ac arcu. Nunc mauris. Morbi non""","""cake, diet""","""Snacks""","""Draft""",5/22/2023 21:39
1107,100038,"""tellus faucibus""","""In mi pede, nonummy ut, molestie in, tempus eu, ligula. Aenean euismod mauris eu elit. Nulla facilisi. Sed neque. Sed eget lacus.""","""keto, diet""","""Broiling""","""Published""",10/7/2023 7:59
1108,100078,"""nisi. Cum""","""nulla. Integer urna. Vivamus molestie dapibus ligula. Aliquam erat volutpat. Nulla dignissim. Maecenas ornare egestas ligula. Nullam feugiat placerat velit.""","""vegetables""","""Baking""","""Draft""",8/31/2023 9:47
1109,100116,"""penatibus et""","""augue ac ipsum. Phasellus vitae mauris sit amet lorem semper auctor. Mauris vel turpis. Aliquam adipiscing lobortis risus. In mi""","""diet""","""Cooking""","""Published""",10/10/2023 6:28
1110,100177,"""Sed pharetra,""","""est tempor bibendum. Donec felis orci, adipiscing non, luctus sit amet, faucibus ut, nulla. Cras eu tellus eu augue porttitor""","""muffins""","""Boiling""","""Published""",6/16/2023 8:20
1111,100140,"""non quam.""","""mus. Aenean eget magna. Suspendisse tristique neque venenatis lacus. Etiam bibendum fermentum metus. Aenean sed pede""","""cookies, soups""","""Frying""","""Draft""",12/8/2023 20:49
1112,100107,"""ac mattis""","""vitae velit egestas lacinia. Sed congue, elit sed consequat auctor, nunc nulla vulputate dui, nec tempus mauris erat eget ipsum. Suspendisse sagittis.""","""butter, keto""","""Baking""","""Published""",3/12/2024 3:13
1113,100194,"""Donec feugiat""","""Curae Donec tincidunt. Donec vitae erat vel pede blandit congue. In scelerisque scelerisque dui. Suspendisse ac metus vitae velit egestas lacinia. Sed congue, elit""","""soups""","""Poaching""","""Draft""",8/4/2023 14:07
1114,100155,"""bibendum fermentum""","""diam dictum sapien. Aenean massa. Integer vitae nibh. Donec est mauris, rhoncus id, mollis nec, cursus a, enim. Suspendisse aliquet, sem ut cursus luctus,""","""pistachios, salads""","""Frying""","""Published""",3/3/2024 23:10
1115,100108,"""Suspendisse sagittis.""","""tincidunt, neque vitae semper egestas, urna justo faucibus lectus, a sollicitudin""","""muffins""","""Snacks""","""Published""",6/3/2023 21:53
1116,100056,"""gravida molestie""","""odio tristique pharetra. Quisque ac libero nec ligula consectetuer rhoncus. Nullam velit dui, semper et, lacinia vitae, sodales at, velit. Pellentesque ultricies dignissim""","""seafood""","""Baking""","""Draft""",11/26/2023 22:42
