post_id,user_id,title,content,tag_name,category_name,status,date_published
1117,100149,"""cursus. Integer""","""parturient montes, nascetur ridiculus mus. Proin vel arcu eu odio tristique pharetra. Quisque ac libero""","""bread""","""Salads""","""Draft""",5/9/2023 13:05
1118,100052,"""ut, pellentesque""","""amet nulla. Donec non justo. Proin non massa non ante bibendum ullamcorper.""","""salads""","""Braising""","""Published""",9/14/2023 22:29
1119,100060,"""Etiam vestibulum""","""hendrerit a, arcu. Sed et libero. Proin mi. Aliquam gravida mauris ut mi. Duis""","""pistachios, soups""","""Sweets""","""Draft""",6/2/2023 17:27
1120,100189,"""in, cursus""","""Nunc quis arcu vel quam dignissim pharetra. Nam ac nulla. In tincidunt congue turpis.""","""cheese cake, muffins""","""Sweets""","""Published""",3/17/2024 23:05
1121,100167,"""Duis volutpat""","""imperdiet nec, leo. Morbi neque tellus, imperdiet non, vestibulum nec, euismod in, dolor. Fusce feugiat. Lorem ipsum dolor""","""pies, pasta""","""Snacks""","""Published""",3/18/2024 13:17
1122,100079,"""vitae, orci.""","""non dui nec urna suscipit nonummy. Fusce fermentum fermentum arcu. Vestibulum ante ipsum primis in faucibus orci luctus""","""keto""","""Steaming""","""Published""",3/20/2024 4:04
1123,100106,"""aliquet odio.""","""sem egestas blandit. Nam nulla magna, malesuada vel, convallis in, cursus et, eros. Proin ultrices.""","""chocolate, butter""","""Frying""","""Published""",4/4/2024 22:26
1124,100080,"""semper auctor.""","""placerat, orci lacus vestibulum lorem, sit amet ultricies sem magna nec""","""muffins""","""Sweets""","""Published""",4/12/2024 16:04
1125,100177,"""Sed nunc""","""eget metus. In nec orci. Donec nibh. Quisque nonummy ipsum non arcu. Vivamus sit amet risus. Donec egestas. Aliquam nec""","""cake""","""Cooking""","""Draft""",3/21/2024 3:55
1126,100136,"""mi felis,""","""cursus. Nunc mauris elit, dictum eu, eleifend nec, malesuada ut, sem.""","""cake, cereals""","""Steaming""","""Draft""",2/7/2024 17:50
1127,100133,"""eros. Nam""","""Nam nulla magna, malesuada vel, convallis in, cursus et, eros.""","""cake""","""Poaching""","""Published""",10/7/2023 13:00
1128,100199,"""quis arcu""","""turpis egestas. Aliquam fringilla cursus purus. Nullam scelerisque neque sed sem egestas blandit. Nam""","""vegetables, bread""","""Roasting""","""Published""",12/13/2023 15:25
1129,100053,"""sociosqu ad""","""in, hendrerit consectetuer, cursus et, magna. Praesent interdum ligula eu enim.""","""seafood, vegetables""","""Frying""","""Draft""",3/27/2024 8:18
1130,100111,"""lobortis tellus""","""facilisis vitae, orci. Phasellus dapibus quam quis diam. Pellentesque habitant morbi tristique senectus et netus et malesuada fames ac turpis egestas. Fusce aliquet magna""","""diet, pie""","""Boiling""","""Draft""",2/9/2024 1:03
1131,100027,"""non, lacinia""","""libero. Proin sed turpis nec mauris blandit mattis. Cras eget nisi dictum augue malesuada malesuada. Integer id magna et ipsum cursus""","""sandwiches, healthy""","""Frying""","""Published""",8/12/2023 10:49
1132,100175,"""egestas, urna""","""magnis dis parturient montes, nascetur ridiculus mus. Aenean eget magna. Suspendisse tristique""","""multigrains""","""Snacks""","""Draft""",1/31/2024 18:32
1133,100034,"""imperdiet, erat""","""sapien, cursus in, hendrerit consectetuer, cursus et, magna. Praesent interdum ligula eu enim. Etiam imperdiet dictum magna. Ut tincidunt orci quis lectus.""","""pasta""","""Cooking""","""Published""",7/4/2023 2:56
1134,100013,"""at, velit.""","""libero et tristique pellentesque, tellus sem mollis dui, in sodales elit erat vitae risus. Duis a mi fringilla mi lacinia mattis. Integer eu lacus.""","""cookies""","""Desserts""","""Published""",10/30/2023 14:23
1135,100112,"""faucibus orci""","""neque sed sem egestas blandit. Nam nulla magna, malesuada vel, convallis in, cursus et,""","""pies""","""Desserts""","""Draft""",12/27/2023 3:49
1136,100196,"""convallis in,""","""commodo auctor velit. Aliquam nisl. Nulla eu neque pellentesque massa lobortis ultrices. Vivamus rhoncus. Donec est. Nunc""","""butter""","""Sweets""","""Published""",11/8/2023 1:46
1137,100008,"""arcu iaculis""","""ligula eu enim. Etiam imperdiet dictum magna. Ut tincidunt orci""","""diet""","""Steaming""","""Published""",7/10/2023 21:44
1138,100011,"""elit, pharetra""","""iaculis quis, pede. Praesent eu dui. Cum sociis natoque penatibus et magnis dis parturient montes, nascetur ridiculus""","""cheese""","""Sweets""","""Draft""",7/18/2023 10:48
1139,100134,"""metus. Aenean""","""ante dictum mi, ac mattis velit justo nec ante. Maecenas mi felis, adipiscing fringilla, porttitor""","""butter""","""Sweets""","""Published""",2/26/2024 2:59
1140,100013,"""mauris erat""","""nascetur ridiculus mus. Aenean eget magna. Suspendisse tristique neque venenatis lacus. Etiam bibendum fermentum metus. Aenean""","""lamb, desserts""","""Baking""","""Published""",8/20/2023 5:39
1141,100096,"""magna nec""","""tellus id nunc interdum feugiat. Sed nec metus facilisis lorem tristique aliquet. Phasellus fermentum convallis ligula. Donec luctus aliquet odio.""","""beef""","""Snacks""","""Published""",4/11/2024 16:27
1142,100046,"""Integer urna.""","""lectus justo eu arcu. Morbi sit amet massa. Quisque porttitor eros nec tellus. Nunc lectus pede,""","""stews""","""Braising""","""Draft""",7/12/2023 15:05
1143,100067,"""ornare. Fusce""","""malesuada malesuada. Integer id magna et ipsum cursus vestibulum. Mauris magna.""","""pasta""","""Sweets""","""Draft""",10/10/2023 14:31
1144,100194,"""sodales at,""","""vel quam dignissim pharetra. Nam ac nulla. In tincidunt congue turpis. In condimentum. Donec""","""pasta, vegan""","""Steaming""","""Draft""",6/15/2023 23:25
1145,100136,"""scelerisque dui.""","""eleifend non, dapibus rutrum, justo. Praesent luctus. Curabitur egestas nunc sed libero. Proin sed turpis nec mauris blandit mattis. Cras eget""","""healthy""","""Sweets""","""Published""",3/23/2024 3:33
1146,100011,"""nibh sit""","""at, iaculis quis, pede. Praesent eu dui. Cum sociis natoque penatibus et magnis dis parturient montes,""","""chocolate, fasting""","""Sweets""","""Published""",1/12/2024 2:28
1147,100147,"""turpis egestas.""","""nulla at sem molestie sodales. Mauris blandit enim consequat purus. Maecenas libero est, congue a, aliquet vel, vulputate""","""cheese""","""Boiling""","""Draft""",2/10/2024 8:47
1148,100168,"""varius ultrices,""","""adipiscing elit. Curabitur sed tortor. Integer aliquam adipiscing lacus. Ut nec urna et arcu imperdiet ullamcorper. Duis""","""brownie""","""Frying""","""Published""",9/6/2023 17:06
1149,100092,"""Cras convallis""","""In ornare sagittis felis. Donec tempor, est ac mattis semper, dui lectus rutrum urna, nec luctus felis purus ac tellus. Suspendisse sed""","""multigrains, pasta""","""Cooking""","""Published""",8/24/2023 20:45
1150,100177,"""faucibus lectus,""","""arcu. Nunc mauris. Morbi non sapien molestie orci tincidunt adipiscing. Mauris molestie pharetra nibh. Aliquam ornare, libero at auctor ullamcorper, nisl arcu iaculis enim,""","""keto""","""Salads""","""Published""",8/15/2023 22:24
1151,100131,"""urna. Vivamus""","""dictum ultricies ligula. Nullam enim. Sed nulla ante, iaculis nec,""","""seafood, pies""","""Poaching""","""Draft""",6/25/2023 8:08
1152,100127,"""nibh. Quisque""","""lacus pede sagittis augue, eu tempor erat neque non quam. Pellentesque habitant morbi tristique senectus et netus et""","""brownie, butter""","""Baking""","""Published""",5/30/2023 12:44
1153,100045,"""fermentum fermentum""","""diam eu dolor egestas rhoncus. Proin nisl sem, consequat nec, mollis vitae, posuere at, velit. Cras lorem lorem, luctus""","""desserts""","""Frying""","""Draft""",11/18/2023 21:35
1154,100143,"""arcu. Vestibulum""","""eu, ligula. Aenean euismod mauris eu elit. Nulla facilisi. Sed neque. Sed""","""desserts, brownie""","""Desserts""","""Draft""",12/5/2023 11:16
1155,100145,"""ac mattis""","""elit sed consequat auctor, nunc nulla vulputate dui, nec tempus mauris erat eget ipsum. Suspendisse sagittis. Nullam vitae diam. Proin dolor. Nulla""","""walnuts""","""Salads""","""Published""",12/8/2023 4:34
1156,100113,"""vel, mauris.""","""aliquet odio. Etiam ligula tortor, dictum eu, placerat eget, venenatis a, magna. Lorem ipsum dolor sit""","""muffins, cashews""","""Frying""","""Draft""",4/1/2024 10:58
1157,100005,"""id enim.""","""nonummy ipsum non arcu. Vivamus sit amet risus. Donec egestas. Aliquam nec enim. Nunc ut erat. Sed nunc""","""bread""","""Poaching""","""Draft""",8/14/2023 16:59
1158,100124,"""nascetur ridiculus""","""natoque penatibus et magnis dis parturient montes, nascetur ridiculus mus. Donec""","""cocoa""","""Desserts""","""Draft""",3/14/2024 22:00
1159,100192,"""Integer in""","""lacinia at, iaculis quis, pede. Praesent eu dui. Cum sociis natoque penatibus et magnis dis parturient montes, nascetur ridiculus""","""cheese""","""Steaming""","""Published""",9/4/2023 18:42
1160,100136,"""Praesent luctus.""","""aliquet, metus urna convallis erat, eget tincidunt dui augue eu tellus. Phasellus elit pede, malesuada vel, venenatis vel, faucibus id, libero. Donec consectetuer""","""chicken""","""Cooking""","""Draft""",10/8/2023 4:25
1161,100158,"""aliquam eros""","""Proin nisl sem, consequat nec, mollis vitae, posuere at, velit. Cras lorem lorem, luctus""","""vegan""","""Cooking""","""Draft""",10/25/2023 5:21
1162,100158,"""dolor dolor,""","""volutpat nunc sit amet metus. Aliquam erat volutpat. Nulla facilisis. Suspendisse commodo tincidunt nibh. Phasellus""","""cookies, walnuts""","""Braising""","""Draft""",8/4/2023 3:03
1163,100091,"""Fusce aliquet""","""eget, dictum placerat, augue. Sed molestie. Sed id risus quis diam luctus lobortis. Class""","""cake, vegetables""","""Frying""","""Published""",4/1/2024 5:43
1164,100183,"""libero. Proin""","""amet lorem semper auctor. Mauris vel turpis. Aliquam adipiscing lobortis risus. In mi pede, nonummy ut, molestie in, tempus eu,""","""chicken, walnuts""","""Baking""","""Draft""",8/1/2023 20:14
1165,100081,"""Phasellus dolor""","""Nullam velit dui, semper et, lacinia vitae, sodales at, velit. Pellentesque ultricies dignissim lacus. Aliquam rutrum lorem ac risus. Morbi metus. Vivamus euismod urna.""","""chicken""","""Roasting""","""Published""",11/24/2023 14:50
1166,100133,"""Donec fringilla.""","""dolor. Quisque tincidunt pede ac urna. Ut tincidunt vehicula risus. Nulla eget metus eu erat semper rutrum. Fusce dolor quam, elementum at, egestas a,""","""butter""","""Broiling""","""Published""",3/17/2024 0:06
1167,100080,"""Aliquam auctor,""","""tellus id nunc interdum feugiat. Sed nec metus facilisis lorem tristique aliquet. Phasellus""","""cheese cake, healthy""","""Sweets""","""Draft""",9/20/2023 23:45
1168,100038,"""sit amet,""","""Nunc sollicitudin commodo ipsum. Suspendisse non leo. Vivamus nibh dolor, nonummy ac, feugiat non, lobortis""","""healthy""","""Baking""","""Published""",7/23/2023 8:13
1169,100057,"""nec orci.""","""interdum ligula eu enim. Etiam imperdiet dictum magna. Ut tincidunt orci quis lectus. Nullam suscipit, est ac facilisis""","""cashews, keto""","""Braising""","""Published""",1/2/2024 12:39
1170,100005,"""luctus et""","""quis urna. Nunc quis arcu vel quam dignissim pharetra. Nam ac nulla. In tincidunt congue""","""noodles""","""Grilling""","""Draft""",3/28/2024 10:40
1171,100016,"""et libero.""","""Donec tincidunt. Donec vitae erat vel pede blandit congue. In scelerisque scelerisque dui. Suspendisse ac metus vitae velit egestas lacinia. Sed""","""bread, fasting""","""Boiling""","""Published""",2/27/2024 23:52
1172,100086,"""ipsum dolor""","""arcu. Vestibulum ut eros non enim commodo hendrerit. Donec porttitor tellus non magna.""","""cashews""","""Poaching""","""Published""",7/19/2023 9:37
1173,100176,"""penatibus et""","""tellus lorem eu metus. In lorem. Donec elementum, lorem ut aliquam iaculis,""","""multigrains, desserts""","""Frying""","""Draft""",6/10/2023 0:01
1174,100031,"""scelerisque scelerisque""","""risus. Duis a mi fringilla mi lacinia mattis. Integer eu lacus. Quisque imperdiet, erat nonummy ultricies ornare, elit elit fermentum risus, at fringilla purus""","""butter""","""Frying""","""Draft""",11/9/2023 11:05
1175,100012,"""nisi sem""","""lobortis mauris. Suspendisse aliquet molestie tellus. Aenean egestas hendrerit neque. In ornare sagittis felis. Donec tempor, est ac mattis semper, dui""","""vegetables""","""Salads""","""Draft""",10/16/2023 16:51
1176,100116,"""Phasellus fermentum""","""aliquet. Proin velit. Sed malesuada augue ut lacus. Nulla tincidunt, neque vitae semper egestas, urna justo""","""keto""","""Broiling""","""Draft""",9/19/2023 10:41
1177,100053,"""in molestie""","""elit. Etiam laoreet, libero et tristique pellentesque, tellus sem mollis dui, in sodales elit erat""","""muffins""","""Snacks""","""Draft""",4/27/2024 3:59
1178,100128,"""parturient montes,""","""ut erat. Sed nunc est, mollis non, cursus non, egestas a, dui. Cras pellentesque. Sed dictum. Proin eget odio. Aliquam vulputate ullamcorper magna. Sed""","""vegan, salads""","""Sweets""","""Draft""",6/16/2023 22:52
1179,100157,"""tempor erat""","""velit justo nec ante. Maecenas mi felis, adipiscing fringilla, porttitor vulputate, posuere vulputate,""","""sandwiches""","""Frying""","""Published""",10/15/2023 21:14
1180,100055,"""ante blandit""","""ultricies ornare, elit elit fermentum risus, at fringilla purus mauris a nunc. In at pede.""","""chicken""","""Steaming""","""Published""",8/9/2023 6:59
1181,100023,"""auctor non,""","""fermentum fermentum arcu. Vestibulum ante ipsum primis in faucibus orci luctus et ultrices posuere cubilia Curae Phasellus ornare. Fusce mollis. Duis sit amet diam eu""","""seafood, bread""","""Broiling""","""Published""",9/18/2023 3:58
1182,100042,"""adipiscing elit.""","""mollis. Duis sit amet diam eu dolor egestas rhoncus. Proin nisl sem, consequat nec, mollis vitae, posuere at, velit. Cras lorem lorem,""","""cake""","""Grilling""","""Draft""",9/28/2023 1:18
1183,100065,"""dui nec""","""euismod ac, fermentum vel, mauris. Integer sem elit, pharetra ut, pharetra sed, hendrerit a, arcu. Sed et libero.""","""muffins, cashews""","""Boiling""","""Published""",12/26/2023 18:47
1184,100009,"""Aliquam erat""","""Ut tincidunt vehicula risus. Nulla eget metus eu erat semper rutrum. Fusce dolor quam, elementum at, egestas a, scelerisque sed, sapien. Nunc pulvinar arcu""","""butter, cereals""","""Braising""","""Published""",7/28/2023 8:13
1185,100063,"""convallis ligula.""","""tristique pellentesque, tellus sem mollis dui, in sodales elit erat vitae risus. Duis a""","""sandwiches""","""Cooking""","""Draft""",7/1/2023 18:11
1186,100126,"""ante, iaculis""","""et magnis dis parturient montes, nascetur ridiculus mus. Donec dignissim magna a""","""seafood""","""Braising""","""Published""",6/12/2023 5:15
1187,100103,"""lacus. Nulla""","""imperdiet nec, leo. Morbi neque tellus, imperdiet non, vestibulum nec, euismod in, dolor. Fusce feugiat. Lorem ipsum dolor sit amet,""","""desserts, chicken""","""Desserts""","""Draft""",1/1/2024 22:27
1188,100022,"""mauris blandit""","""In lorem. Donec elementum, lorem ut aliquam iaculis, lacus pede sagittis augue, eu tempor erat neque non quam. Pellentesque""","""chocolate""","""Braising""","""Published""",7/26/2023 16:43
1189,100002,"""ut nisi""","""lacus vestibulum lorem, sit amet ultricies sem magna nec quam. Curabitur vel lectus. Cum sociis natoque penatibus et magnis""","""bread""","""Grilling""","""Published""",3/7/2024 22:26
1190,100161,"""libero mauris,""","""vel turpis. Aliquam adipiscing lobortis risus. In mi pede, nonummy ut, molestie in,""","""pasta""","""Broiling""","""Published""",7/10/2023 0:24
1191,100105,"""euismod enim.""","""Phasellus libero mauris, aliquam eu, accumsan sed, facilisis vitae, orci. Phasellus dapibus quam quis diam. Pellentesque habitant morbi tristique senectus et netus et malesuada fames""","""pistachios, fasting""","""Snacks""","""Draft""",2/3/2024 5:47
1192,100002,"""pede sagittis""","""ultrices posuere cubilia Curae Donec tincidunt. Donec vitae erat vel pede blandit congue. In scelerisque scelerisque dui. Suspendisse""","""cookies, eggs""","""Boiling""","""Published""",11/3/2023 19:04
1193,100151,"""sem eget""","""lacinia. Sed congue, elit sed consequat auctor, nunc nulla vulputate dui, nec tempus mauris""","""chicken, eggs""","""Poaching""","""Draft""",9/10/2023 17:29
1194,100125,"""diam. Pellentesque""","""feugiat. Sed nec metus facilisis lorem tristique aliquet. Phasellus fermentum convallis ligula. Donec luctus aliquet odio. Etiam ligula tortor,""","""cheese, noodles""","""Baking""","""Draft""",4/19/2024 8:33
1195,100042,"""vitae, posuere""","""nibh vulputate mauris sagittis placerat. Cras dictum ultricies ligula. Nullam enim. Sed nulla ante, iaculis nec, eleifend non, dapibus rutrum, justo.""","""butter""","""Cooking""","""Draft""",11/25/2023 6:03
1196,100144,"""ipsum primis""","""blandit viverra. Donec tempus, lorem fringilla ornare placerat, orci lacus""","""noodles, brownie""","""Frying""","""Published""",4/17/2024 10:58
1197,100158,"""augue id""","""fringilla ornare placerat, orci lacus vestibulum lorem, sit amet ultricies sem magna nec quam. Curabitur vel lectus. Cum sociis natoque""","""cookies, cereals""","""Baking""","""Published""",9/11/2023 5:27
1198,100027,"""quis massa.""","""Pellentesque ut ipsum ac mi eleifend egestas. Sed pharetra, felis eget varius ultrices, mauris ipsum porta elit, a feugiat tellus lorem eu metus.""","""pasta""","""Grilling""","""Draft""",5/10/2023 18:50
1199,100150,"""Donec feugiat""","""ac, feugiat non, lobortis quis, pede. Suspendisse dui. Fusce diam nunc,""","""cake, seafood""","""Roasting""","""Published""",1/13/2024 3:20
1200,100013,"""parturient montes,""","""orci lacus vestibulum lorem, sit amet ultricies sem magna nec quam. Curabitur vel lectus. Cum sociis natoque penatibus et magnis dis parturient""","""pasta, healthy""","""Steaming""","""Draft""",11/3/2023 10:12
1201,100189,"""Phasellus fermentum""","""enim. Nunc ut erat. Sed nunc est, mollis non, cursus non, egestas a, dui.""","""cookies, cake""","""Grilling""","""Draft""",7/19/2023 0:46
1202,100082,"""eu turpis.""","""malesuada vel, convallis in, cursus et, eros. Proin ultrices. Duis volutpat nunc sit""","""pasta, chocolate""","""Steaming""","""Published""",12/23/2023 9:36
1203,100063,"""nec, eleifend""","""nisl. Nulla eu neque pellentesque massa lobortis ultrices. Vivamus rhoncus. Donec est. Nunc ullamcorper, velit in aliquet lobortis, nisi nibh lacinia orci,""","""vegan""","""Braising""","""Published""",8/13/2023 23:33
1204,100186,"""augue porttitor""","""lorem, luctus ut, pellentesque eget, dictum placerat, augue. Sed molestie. Sed id risus""","""beef""","""Steaming""","""Draft""",9/29/2023 0:03
1205,100018,"""Vivamus nibh""","""cursus. Nunc mauris elit, dictum eu, eleifend nec, malesuada ut, sem. Nulla interdum. Curabitur dictum. Phasellus in felis. Nulla tempor augue""","""almonds""","""Roasting""","""Published""",5/8/2023 13:42
1206,100068,"""at lacus.""","""non enim. Mauris quis turpis vitae purus gravida sagittis. Duis gravida. Praesent eu nulla at sem molestie sodales. Mauris blandit enim consequat purus. Maecenas""","""eggs, stews""","""Salads""","""Draft""",5/13/2023 11:38
1207,100022,"""elementum sem,""","""placerat velit. Quisque varius. Nam porttitor scelerisque neque. Nullam nisl. Maecenas malesuada fringilla est. Mauris eu turpis. Nulla aliquet. Proin velit. Sed malesuada augue ut""","""pies""","""Broiling""","""Draft""",4/29/2024 8:46
1208,100098,"""Duis sit""","""ornare, elit elit fermentum risus, at fringilla purus mauris a nunc. In at pede. Cras vulputate velit eu sem. Pellentesque ut ipsum ac mi eleifend""","""healthy""","""Frying""","""Published""",3/14/2024 9:07
1209,100026,"""risus. Duis""","""amet lorem semper auctor. Mauris vel turpis. Aliquam adipiscing lobortis risus. In""","""cheese cake""","""Broiling""","""Draft""",3/14/2024 2:09
1210,100193,"""commodo at,""","""rhoncus. Donec est. Nunc ullamcorper, velit in aliquet lobortis, nisi nibh lacinia orci,""","""cake, noodles""","""Desserts""","""Published""",3/27/2024 22:21
1211,100195,"""pede. Cras""","""metus. In nec orci. Donec nibh. Quisque nonummy ipsum non arcu. Vivamus sit""","""pistachios""","""Desserts""","""Draft""",9/5/2023 19:54
1212,100153,"""Integer tincidunt""","""orci. Ut semper pretium neque. Morbi quis urna. Nunc quis arcu vel quam""","""keto""","""Frying""","""Draft""",10/24/2023 9:26
1213,100024,"""netus et""","""nulla at sem molestie sodales. Mauris blandit enim consequat purus. Maecenas libero est, congue a, aliquet""","""cocoa, vegetables""","""Broiling""","""Draft""",1/20/2024 5:16
1214,100044,"""nascetur ridiculus""","""aptent taciti sociosqu ad litora torquent per conubia nostra, per inceptos hymenaeos. Mauris ut quam vel sapien imperdiet ornare. In faucibus. Morbi vehicula.""","""butter""","""Snacks""","""Draft""",9/6/2023 1:58
1215,100171,"""fringilla mi""","""consequat purus. Maecenas libero est, congue a, aliquet vel, vulputate eu, odio. Phasellus at augue""","""keto""","""Grilling""","""Published""",4/17/2024 9:35
1216,100023,"""Pellentesque ultricies""","""nec tempus mauris erat eget ipsum. Suspendisse sagittis. Nullam vitae diam. Proin dolor. Nulla semper tellus id nunc""","""soups""","""Cooking""","""Published""",7/1/2023 16:01
1217,100077,"""diam nunc,""","""Curabitur dictum. Phasellus in felis. Nulla tempor augue ac ipsum. Phasellus vitae mauris sit amet lorem semper auctor.""","""chicken, healthy""","""Grilling""","""Published""",6/27/2023 15:15
1218,100047,"""aliquet vel,""","""ipsum dolor sit amet, consectetuer adipiscing elit. Etiam laoreet, libero et tristique pellentesque, tellus sem mollis dui, in""","""pies""","""Braising""","""Published""",8/26/2023 8:00
1219,100070,"""egestas ligula.""","""lorem, sit amet ultricies sem magna nec quam. Curabitur vel lectus. Cum sociis""","""brownie, vegan""","""Poaching""","""Published""",8/30/2023 17:14
1220,100134,"""rhoncus. Donec""","""et, eros. Proin ultrices. Duis volutpat nunc sit amet metus. Aliquam erat volutpat. Nulla""","""pizza, diet""","""Roasting""","""Draft""",3/8/2024 14:24
1221,100133,"""lacus. Quisque""","""eleifend nec, malesuada ut, sem. Nulla interdum. Curabitur dictum. Phasellus in felis. Nulla tempor augue ac ipsum. Phasellus vitae mauris sit amet lorem semper""","""cocoa""","""Cooking""","""Published""",1/30/2024 16:57
1222,100040,"""tempus mauris""","""laoreet, libero et tristique pellentesque, tellus sem mollis dui, in sodales elit erat""","""butter""","""Boiling""","""Draft""",12/13/2023 15:20
1223,100007,"""et libero.""","""vulputate mauris sagittis placerat. Cras dictum ultricies ligula. Nullam enim. Sed nulla ante, iaculis nec, eleifend non, dapibus rutrum, justo. Praesent luctus. Curabitur""","""pies, soups""","""Boiling""","""Published""",9/13/2023 12:13
1224,100075,"""eu turpis.""","""Duis ac arcu. Nunc mauris. Morbi non sapien molestie orci tincidunt adipiscing. Mauris molestie pharetra nibh. Aliquam ornare, libero""","""stews""","""Salads""","""Draft""",7/2/2023 23:31
1225,100015,"""odio. Nam""","""sapien imperdiet ornare. In faucibus. Morbi vehicula. Pellentesque tincidunt tempus risus. Donec egestas. Duis ac arcu. Nunc mauris. Morbi non sapien molestie orci""","""vegan""","""Frying""","""Published""",8/7/2023 15:04
1226,100018,"""amet, consectetuer""","""malesuada fames ac turpis egestas. Fusce aliquet magna a neque. Nullam""","""vegetables""","""Roasting""","""Draft""",12/15/2023 14:48
1227,100032,"""Aenean sed""","""amet metus. Aliquam erat volutpat. Nulla facilisis. Suspendisse commodo tincidunt nibh. Phasellus nulla. Integer""","""keto""","""Poaching""","""Draft""",5/20/2023 3:50
1228,100166,"""iaculis enim,""","""scelerisque neque sed sem egestas blandit. Nam nulla magna, malesuada vel, convallis in, cursus et, eros. Proin""","""cheese, pies""","""Baking""","""Published""",1/24/2024 16:25
1229,100102,"""faucibus orci""","""quam quis diam. Pellentesque habitant morbi tristique senectus et netus et malesuada fames ac""","""vegan""","""Cooking""","""Draft""",10/6/2023 22:53
1230,100118,"""metus. Aliquam""","""Nunc mauris elit, dictum eu, eleifend nec, malesuada ut, sem. Nulla interdum. Curabitur dictum. Phasellus in felis. Nulla tempor augue""","""butter""","""Boiling""","""Published""",1/10/2024 12:18
1231,100178,"""Aliquam fringilla""","""arcu. Morbi sit amet massa. Quisque porttitor eros nec tellus. Nunc lectus pede, ultrices""","""walnuts, stews""","""Snacks""","""Published""",12/7/2023 1:35
1232,100120,"""enim. Mauris""","""Praesent luctus. Curabitur egestas nunc sed libero. Proin sed turpis nec mauris""","""beef""","""Cooking""","""Published""",5/29/2023 6:28
1233,100144,"""nunc est,""","""Phasellus nulla. Integer vulputate, risus a ultricies adipiscing, enim mi""","""healthy, walnuts""","""Poaching""","""Draft""",8/21/2023 21:20
1234,100050,"""orci. Ut""","""In tincidunt congue turpis. In condimentum. Donec at arcu. Vestibulum ante ipsum primis""","""noodles""","""Sweets""","""Draft""",8/16/2023 8:35
1235,100092,"""neque pellentesque""","""euismod et, commodo at, libero. Morbi accumsan laoreet ipsum. Curabitur consequat, lectus sit amet luctus vulputate, nisi sem semper erat, in consectetuer ipsum nunc id""","""seafood""","""Salads""","""Published""",6/25/2023 8:32
1236,100093,"""tempor lorem,""","""Nam nulla magna, malesuada vel, convallis in, cursus et, eros. Proin ultrices. Duis volutpat nunc sit amet metus. Aliquam""","""bread, diet""","""Frying""","""Draft""",11/25/2023 16:22
1237,100004,"""adipiscing. Mauris""","""sociis natoque penatibus et magnis dis parturient montes, nascetur ridiculus mus. Proin vel arcu eu odio tristique pharetra. Quisque ac""","""salads""","""Poaching""","""Draft""",6/9/2023 9:26
