post_id,user_id,title,content,tag_name,category_name,status,date_published
1358,100026,"""ac orci.""","""Fusce mi lorem, vehicula et, rutrum eu, ultrices sit amet, risus. Donec nibh enim, gravida sit""","""stews, vegan""","""Grilling""","""Published""",3/15/2024 2:06
1359,100139,"""odio. Etiam""","""eget nisi dictum augue malesuada malesuada. Integer id magna et ipsum""","""multigrains""","""Poaching""","""Draft""",3/24/2024 7:04
1360,100077,"""tellus faucibus""","""Cras interdum. Nunc sollicitudin commodo ipsum. Suspendisse non leo. Vivamus nibh dolor, nonummy ac, feugiat non, lobortis quis,""","""butter""","""Grilling""","""Draft""",12/26/2023 15:30
1361,100131,"""dictum eu,""","""Curabitur sed tortor. Integer aliquam adipiscing lacus. Ut nec urna""","""sandwiches, salads""","""Sweets""","""Draft""",7/16/2023 8:21
1362,100046,"""tempus risus.""","""egestas a, scelerisque sed, sapien. Nunc pulvinar arcu et pede. Nunc""","""walnuts""","""Salads""","""Published""",4/8/2024 5:03
1363,100010,"""gravida nunc""","""cursus. Nunc mauris elit, dictum eu, eleifend nec, malesuada ut, sem. Nulla interdum. Curabitur dictum. Phasellus""","""sandwiches""","""Broiling""","""Published""",6/25/2023 10:56
1364,100024,"""vehicula risus.""","""id, libero. Donec consectetuer mauris id sapien. Cras dolor dolor,""","""walnuts""","""Snacks""","""Draft""",1/16/2024 19:11
1365,100069,"""gravida nunc""","""orci lacus vestibulum lorem, sit amet ultricies sem magna nec quam. Curabitur vel lectus. Cum sociis natoque penatibus et magnis dis parturient montes, nascetur ridiculus""","""stews, cookies""","""Cooking""","""Published""",1/16/2024 22:21
1366,100028,"""amet ultricies""","""Donec elementum, lorem ut aliquam iaculis, lacus pede sagittis augue, eu tempor erat neque non quam. Pellentesque""","""desserts, butter""","""Frying""","""Published""",1/9/2024 18:17
1367,100132,"""dis parturient""","""at sem molestie sodales. Mauris blandit enim consequat purus. Maecenas libero est, congue a, aliquet vel, vulputate""","""cake""","""Poaching""","""Published""",1/26/2024 1:30
1368,100014,"""sem mollis""","""dolor. Quisque tincidunt pede ac urna. Ut tincidunt vehicula risus. Nulla eget metus eu erat semper rutrum. Fusce dolor quam, elementum""","""chicken, butter""","""Sweets""","""Published""",2/7/2024 21:26
1369,100035,"""dui. Cum""","""pede sagittis augue, eu tempor erat neque non quam. Pellentesque habitant morbi""","""keto""","""Steaming""","""Published""",6/18/2023 17:26
1370,100179,"""eget tincidunt""","""pharetra nibh. Aliquam ornare, libero at auctor ullamcorper, nisl arcu iaculis enim, sit amet ornare lectus""","""lamb, cookies""","""Cooking""","""Published""",6/22/2023 2:46
1371,100138,"""Nunc ut""","""mauris sapien, cursus in, hendrerit consectetuer, cursus et, magna. Praesent interdum ligula eu""","""sandwiches, bread""","""Sweets""","""Published""",5/1/2024 15:05
1372,100080,"""Duis sit""","""non, dapibus rutrum, justo. Praesent luctus. Curabitur egestas nunc sed libero. Proin sed turpis nec""","""pasta""","""Snacks""","""Published""",8/22/2023 16:58
1373,100197,"""orci lacus""","""et netus et malesuada fames ac turpis egestas. Aliquam fringilla cursus purus. Nullam scelerisque neque sed sem egestas blandit. Nam nulla magna,""","""cheese cake""","""Boiling""","""Draft""",10/27/2023 11:13
1374,100038,"""pede. Praesent""","""consectetuer adipiscing elit. Aliquam auctor, velit eget laoreet posuere, enim""","""cheese cake""","""Snacks""","""Draft""",11/29/2023 4:47
1375,100109,"""Suspendisse commodo""","""consequat purus. Maecenas libero est, congue a, aliquet vel, vulputate eu, odio. Phasellus at augue id ante dictum cursus. Nunc mauris""","""desserts, cheese""","""Steaming""","""Draft""",2/24/2024 1:00
1376,100110,"""Nunc quis""","""fermentum arcu. Vestibulum ante ipsum primis in faucibus orci luctus et""","""fasting, sandwiches""","""Desserts""","""Published""",8/30/2023 17:52
1377,100070,"""dapibus ligula.""","""quis urna. Nunc quis arcu vel quam dignissim pharetra. Nam ac nulla. In tincidunt congue turpis. In condimentum. Donec""","""pasta, beef""","""Desserts""","""Published""",7/19/2023 20:49
1378,100074,"""nibh enim,""","""vitae odio sagittis semper. Nam tempor diam dictum sapien. Aenean massa. Integer vitae nibh. Donec est mauris, rhoncus id,""","""vegetables, butter""","""Braising""","""Draft""",2/19/2024 6:31
1379,100132,"""Suspendisse aliquet,""","""nisl. Quisque fringilla euismod enim. Etiam gravida molestie arcu. Sed eu nibh vulputate mauris sagittis placerat. Cras dictum ultricies ligula. Nullam enim. Sed""","""multigrains""","""Steaming""","""Draft""",4/29/2024 3:16
1380,100057,"""sagittis semper.""","""vulputate ullamcorper magna. Sed eu eros. Nam consequat dolor vitae dolor. Donec fringilla. Donec""","""stews""","""Roasting""","""Published""",12/11/2023 10:27
1381,100171,"""nunc interdum""","""lorem ut aliquam iaculis, lacus pede sagittis augue, eu tempor erat neque non quam. Pellentesque habitant morbi tristique senectus et netus et malesuada fames""","""pie, cookies""","""Frying""","""Published""",6/27/2023 13:23
1382,100046,"""Suspendisse ac""","""ut, nulla. Cras eu tellus eu augue porttitor interdum. Sed auctor odio""","""seafood""","""Steaming""","""Draft""",3/7/2024 8:16
1383,100108,"""eleifend vitae,""","""Integer id magna et ipsum cursus vestibulum. Mauris magna. Duis dignissim tempor arcu. Vestibulum ut eros""","""butter""","""Cooking""","""Published""",1/21/2024 21:29
1384,100196,"""risus. In""","""lacus. Etiam bibendum fermentum metus. Aenean sed pede nec ante blandit viverra.""","""stews""","""Broiling""","""Draft""",4/27/2024 9:41
1385,100129,"""leo, in""","""eget mollis lectus pede et risus. Quisque libero lacus, varius et, euismod et, commodo at, libero. Morbi accumsan laoreet ipsum. Curabitur""","""soups, bread""","""Baking""","""Draft""",11/5/2023 6:21
1386,100093,"""sem semper""","""nec tellus. Nunc lectus pede, ultrices a, auctor non, feugiat nec, diam. Duis mi enim, condimentum eget, volutpat ornare,""","""bread""","""Baking""","""Published""",2/22/2024 14:12
1387,100117,"""sapien. Cras""","""libero mauris, aliquam eu, accumsan sed, facilisis vitae, orci. Phasellus dapibus quam quis diam. Pellentesque habitant morbi tristique senectus et netus et malesuada fames""","""eggs, bread""","""Frying""","""Draft""",1/3/2024 23:44
1388,100038,"""Aliquam gravida""","""Mauris vestibulum, neque sed dictum eleifend, nunc risus varius orci, in consequat enim diam vel arcu. Curabitur ut odio vel est""","""noodles""","""Steaming""","""Published""",7/19/2023 17:22
1389,100196,"""id enim.""","""non, luctus sit amet, faucibus ut, nulla. Cras eu tellus eu augue porttitor interdum. Sed auctor odio a purus. Duis elementum, dui""","""pie""","""Baking""","""Draft""",1/27/2024 1:59
1390,100032,"""dolor dapibus""","""Praesent luctus. Curabitur egestas nunc sed libero. Proin sed turpis nec mauris blandit mattis. Cras eget nisi dictum augue malesuada malesuada. Integer id""","""eggs""","""Roasting""","""Draft""",10/21/2023 12:09
1391,100188,"""a odio""","""Morbi quis urna. Nunc quis arcu vel quam dignissim pharetra. Nam ac nulla. In tincidunt""","""healthy, cocoa""","""Desserts""","""Published""",10/2/2023 18:56
1392,100180,"""fames ac""","""Class aptent taciti sociosqu ad litora torquent per conubia nostra, per inceptos hymenaeos. Mauris ut quam vel sapien imperdiet ornare. In faucibus. Morbi vehicula.""","""pistachios""","""Salads""","""Draft""",8/21/2023 8:55
1393,100059,"""nisi sem""","""Curae Donec tincidunt. Donec vitae erat vel pede blandit congue. In scelerisque scelerisque dui. Suspendisse ac metus vitae velit""","""chocolate, cookies""","""Broiling""","""Published""",10/14/2023 1:37
1394,100072,"""a, malesuada""","""placerat velit. Quisque varius. Nam porttitor scelerisque neque. Nullam nisl. Maecenas malesuada fringilla est. Mauris eu turpis. Nulla aliquet. Proin velit. Sed malesuada augue ut""","""cocoa, stews""","""Poaching""","""Published""",9/11/2023 21:36
1395,100025,"""nec urna""","""ac ipsum. Phasellus vitae mauris sit amet lorem semper auctor. Mauris vel turpis. Aliquam adipiscing lobortis risus. In mi pede, nonummy ut, molestie in,""","""chocolate""","""Snacks""","""Draft""",8/15/2023 9:54
1396,100086,"""tellus faucibus""","""tortor. Nunc commodo auctor velit. Aliquam nisl. Nulla eu neque pellentesque massa lobortis ultrices. Vivamus rhoncus.""","""keto, pizza""","""Poaching""","""Published""",3/28/2024 4:21
1397,100051,"""est ac""","""Phasellus at augue id ante dictum cursus. Nunc mauris elit, dictum eu, eleifend nec, malesuada ut, sem. Nulla""","""cheese, vegetables""","""Broiling""","""Published""",12/31/2023 7:30
1398,100111,"""in magna.""","""fringilla cursus purus. Nullam scelerisque neque sed sem egestas blandit. Nam nulla magna, malesuada vel, convallis in, cursus""","""desserts""","""Frying""","""Published""",8/1/2023 10:36
1399,100126,"""dis parturient""","""sociis natoque penatibus et magnis dis parturient montes, nascetur ridiculus mus. Donec""","""multigrains""","""Baking""","""Draft""",3/10/2024 4:52
